key,title,year,month,day,journal,issn,volume,issue,pages,authors,url,language,publisher,location,abstract,notes,doi,keywords,pubmed_id,pmc_id
rayyan-389728322,Vulnerability patterns of road network to extreme floods based on accessibility measures,2021,11,1,TRANSPORTATION RESEARCH PART D-TRANSPORT AND ENVIRONMENT,1361-9209,100,,,"Papilloud, T and Keiler, M",,,,,"Accessibility is a key measure of the vulnerability of road networks to disruptions such as floods. However, studies comparing the contribution of parameters to the accuracy of accessibility-based vulnerability assessment are lacking. We propose modifying two accessibility measures to include flood-affected populations, opportunities, and average shortest travel time. We also applied three methods including the divergent ranking method to identify the direct impact of extreme floods on road networks. The shortest travel time pathway calculation was enhanced with the inclusion of spatially distributed settlements as an input. The results indicate a strong relationship between parameter weights and the accessibility measures, irrespective of the evaluated approaches. The results of the study highlight that measures of overall vulnerability, with respect to inter comparisons of flood scenarios alone, do not fully capture the local vulnerability of some traffic zones. This is particularly evident with the flooding of highly connected roads that serve these zones.","<p>Export Date: 16 November 2022</p>
<p>Export Date: 16 November 2022</p> | RAYYAN-INCLUSION: {""Xuhui""=>""Included""} | RAYYAN-LABELS: road,impact,network,vulnerability,m:network metrics | USER-NOTES: {""Xuhui""=>[""- use accessibility to measture the vulnerability of networks.\n- accessibility includes flood-affected populations, oppotunities and averageshortest travel time\n- raise a method to method direct impact"", ""方法：基础网络指标\n描述：提出三种不同的洪水影响指标（会被影响的道路/总道路，全体中介度，平均中介度）。然后对交通网络空间进行可达性计算，加入新两种参数（平均最短出行时间和机会成本）。\n目的：用以上这些数，找到道路vulnerability""]}",10.1016/j.trd.2021.103045,accessibility;Accessibility measures;Accessibility-based vulnerability;Average short travel time path;Average shortest travel time path;Divergents;extreme event;Extreme flood;Extreme flood impact;Extreme flood impacts;flood;Floods;Influence of applied parameter;Influence of applied parameters;Motor transportation;network analysis;Network analysis;Network security;road;Road network;Roads and streets;Shortest travel time;travel time;Travel time;vulnerability;Vulnerability assessments,,
rayyan-389728323,Critical infrastructure impact assessment due to flood exposure,2018,3,1,JOURNAL OF FLOOD RISK MANAGEMENT,1753-318X,11,1,22-33,"Pant, R and Thacker, S and Hall, JW and Alderson, D and Barr, S",,,,,"Critical national infrastructures, including energy, transport, digital communications, and water, are prone to flood damage. Their geographical extent is a determinant of, and is determined by, patterns of human development, which is often concentrated in floodplains. It is important to understand how infrastructure systems react to large-scale flooding. In this paper, we present an integrated framework for critical infrastructure flood impact assessment. Within this integrated framework, we represent interdependent infrastructure assets through spatial network models. We quantify infrastructure flood impacts in terms of disrupted customers linked directly to flood assets and customers disrupted indirectly due to network effects. The analysis shows how spatial network models inform flood risk management practitioners to identify and compare critical infrastructures risks on flooded and non-flooded land, for prioritising flood protection investments and improve resilience of cities. A case study of the Thames catchment in England is presented, which contains key infrastructure assets and highest population concentrations in United Kingdom.","RAYYAN-INCLUSION: {""Xuhui""=>""Included""} | RAYYAN-LABELS: impact,network,infrastructure,m:networkDemand | USER-NOTES: {""Xuhui""=>[""- quantify infrastructure flood impacts in terms of disrupted customers linked directly to flood assets and customers disrupted indirectly due to network effects\n- focus on the risk analysis/impact of infrastructure"", ""方法：网格需求法\n描述：首先构造不同层次的节点，source（设施位置），intermediate（过程），sink（人口位置）。基于人口密度图和基础设施位置做泰森多边形，得出每个设施需要服务的人口数。基于人口点位和设施位置，寻找之间的最短路径（需要注意设施可提供的最大值。如果超过最大值，找最近设施），然后把对应的需求量累加到source上。在就近设施里，可以把一些直接需求映射到周边source，得到indirect customer demand（到底哪一些是indirect disruption，文章没说清楚怎么算）。当淹没图和基础设施的几何图形相交时，则算为基础设施崩溃。\n目的：算出，灾害来了之后，基础设施网络崩溃带来的直接或间接影响\n补充：基础设施的组合（电，水，垃圾，飞机放在一起算），算法在System-of-systems formulation and disruption analysis for multi-scale critical national infrastructures\n""]}",10.1111/jfr3.12288,"",,
rayyan-389728324,Characterization of the Vulnerability of Road Networks to Fluvial Flooding Using Network Percolation Approach,2019,,,"COMPUTING IN CIVIL ENGINEERING 2019: SMART CITIES, SUSTAINABILITY, AND RESILIENCE",978-0-7844-8244-5,,,428-435,"Abdulla, B and Mostafavi, A and Birgisson, B and Cho, YK and Leite, F and Behzadan, A and Wang, C",,,,,"The objective of this paper is to model and characterize the percolation dynamics in road networks during a major fluvial flooding event. First, a road system is modelled as planar graph, then, using the level of co-location interdependency with flood control infrastructure as a proxy to the flood vulnerability of the road networks, it estimated the extent of disruptions each neighborhood road network experienced during a flooding event. Second, percolation mechanism in the road network during the flood is captured by assigning different removal probabilities to nodes in road network according to a Bayesian rule. Finally, temporal changes in road network robustness were obtained for random and weighted-adjusted node-removal scenarios. The proposed method was applied to road flooding in a super neighborhood in Houston during hurricane Harvey. The result shows that, network percolation due to fluvial flooding, which is modelled with the proposed Bayes rule based node-removal scheme, causes the decrease in the road network connectivity at varying rate.","RAYYAN-INCLUSION: {""Xuhui""=>""Included""} | RAYYAN-LABELS: road,network,robustness,vulnerability,m:connectivity,m:network metrics | USER-NOTES: {""Xuhui""=>[""- a road system is modeled as a planar graph, \n- using the level of co-location interdependency with flood control infrastructure as a proxy to the flood vulnerability of the road networks, it estimated the extent of disruptions each neighborhood road network experienced during a flooding event(focus on the neighborhood). \n- percolation mechanism in the road network during the flood is captured by assigning different removal probabilities to nodes in the road network according to a Bayesian rule. \n- temporal changes in road network robustness were obtained for random and weighted-adjusted node-removal scenarios."", ""方法：基础网格指标法\n描述：通过传染病扩散模型，研究路网遇到洪水后的扩散现象。基于不同中心性数值，对不同路段进行断开，研究断开后的路网连接性（巨连通集大小的思路）\n目的：通过移除道路，得到网络的robustness变化\n补充：为什么要随机选或者按照中心性高的断，找些可能会被淹的，且中心性高的断，不好吗？""]}",,"",,
rayyan-389728325,Flood risk assessment and coping capacity of floods in central Vietnam,2017,3,1,JOURNAL OF HYDRO-ENVIRONMENT RESEARCH,1570-6443,14,,44-60,"Vu, TT and Ranzi, R",https://www.scopus.com/inward/record.uri?eid=2-s2.0-84988850982&doi=10.1016%2fj.jher.2016.06.001&partnerID=40&md5=aaf3a0901729188c5037dc21f452d946,,,,"In the perspective of improving and disseminating risk assessment methodologies and rise preparedness of people to flood hazard this paper presents flood hazard maps estimated in the Quang Ngai province, in central Vietnam, for different return periods in terms of depth, duration and velocity using the FLO-2D, hydrodynamic model with a 90 m x 90 m resolution grid. Then, based on the vulnerability functions determined from field surveys and the feedback to 400 questionnaires distributed to people regarding residential areas, paddy rice, road networks and the number of deaths and injuries, the total amount of tangible and intangible damage at each point in the study area is estimated and mapped, indicating risk levels and expected annual damage in case of flooding. The resulting damage functions are quite different from others available in the literature, as a result of the adaptive capacity and the resilience of the population to floods in the investigated area. Damage functions to buildings, agricultural areas, road infrastructures and people are normalised with respect to mean flooding depth and flooding hazard so that they can be generalized to areas with similar geographical conditions. In this way, a more comprehensive knowledge on the negative effects of floods is carried out, providing an important input to flood management plans in order to mitigate flood damage in tropical areas similar to the Quang Ngai province. (C) 2016 International Association for Hydro-environment Engineering and Research, Asia Pacific Division. Published by Elsevier B.V. All rights reserved.","<p>Export Date: 16 November 2022</p>
<p>Export Date: 16 November 2022</p>
<p>Export Date: 21 November 2022</p> | RAYYAN-INCLUSION: {""Xuhui""=>""Included""} | RAYYAN-LABELS: road,impact,m:cost,flood model,vulnerability,m:questionnaire | USER-NOTES: {""Xuhui""=>[""- flow model\n- use vulnerbility function and questionnaire to collect the impact of flood\n- focus on the damage function"", ""方法：问卷法和成本函数\n描述：使用问卷法，对受灾群众的受灾内容进行界定。然后根据成本函数和洪水淹没时长，估算遇难的人数，受灾的水稻，访问和路网的维修费用（路网就是直接看浸泡、侵蚀程度）\n目的：预估洪水带来的经济损失\n""]}",10.1016/j.jher.2016.06.001,coping strategy;disaster management;Expected annual damages;FLO-2D;Flood control;flood damage;Flood damage;Flood hazard;Flood hazards;Flood risk;Flood risk assessments;Flood risks;flooding;Floods;Geographical conditions;hazard assessment;Hazards;hydrodynamics;mapping;Pitting;questionnaire survey;risk assessment;Risk assessment;Risk assessment methodologies;Risk perception;Road infrastructures;Roads and streets;Surveys;Viet Nam;Vietnam;Risk Assessment,,
rayyan-389728326,Vulnerability Assessment in Co-Located Flood Control and Transportation Networks,2020,,,CONSTRUCTION RESEARCH CONGRESS 2020: INFRASTRUCTURE SYSTEMS AND SUSTAINABILITY,978-0-7844-8285-8,,,751-760,"Farahmand, H and Dong, SJ and Mostafavi, A and ElAsmar, M and Tang, P and Grau, D",,,,,"The objective of this paper is to investigate the interdependent transportation-flood control infrastructure vulnerability in the face of the fluvial flooding. A percolation simulation tool is employed to evaluate the flood-disrupted network functionality. First, a spatio-topological analysis is performed to model flood control infrastructure as a channel network and assess the vulnerability of the channels. Second, transportation infrastructure is modeled as a network of roads and inundation probabilities are estimated using their distance to the nearest channel together with the vulnerability of the channel. Finally, the post-flooding functionality of the road network is evaluated using graph-based measures. The framework is tested on a combined watershed in Harris County, Texas. Results show that failure of 10% of roads leads to a considerable loss of functionality in the road network. There are clusters of inundated roads in areas where the high density of development is concentrated around channels. The flood inundation also induces secondary impact by isolating the cluster of roads from the giant component. Such indirect connectivity disruption generally occurs in the areas with lower redundancy. The proposed framework provides an effective tool to inform the collaborative decision-making of flood control and transportation agencies to ensure network accessibility and better prepare the community for future flood hazards.","<p>Export Date: 16 November 2022</p>
<p>Export Date: 16 November 2022</p> | RAYYAN-INCLUSION: {""Xuhui""=>""Included""} | RAYYAN-LABELS: road,network,vulnerability,m:connectivity,m:network metrics | USER-NOTES: {""Xuhui""=>[""- a model that use perception to evaluate the connectivity of network\n- a spatio-topological analysis is performed to model flood control infrastructure as a channel network and assess the vulnerability of the channels.\n- transportation infrastructure is modeled as a network of roads and inundation probabilities are estimated using their distance to the nearest channel together with the vulnerability of the channel.\n- the post-flooding functionality of the road network is evaluated using graph-based measures."", ""方法：基础网络指标法\n描述：把洪水网络图和交通路网图相叠，去掉直接接触到的路网，视为直接影响。然后用渗流法（巨连通集的大小），看看有多少路网会断开，视为间接影响。\n目的：网络的vulnerability\n""]}",,Collaborative decision making;Control infrastructures;Decision making;Flood control;Floods;Graphic methods;Network functionality;Network security;Roads and streets;Solvents;Sustainable development;Topological analysis;Topology;Transportation agencies;Transportation infrastructures;Transportation network;Vulnerability assessments,,
rayyan-389728327,Resiliency Assessment of Road Networks during Mega Sport Events: The Case of FIFA World Cup Qatar 2022,2021,11,1,Sustainability (Switzerland),2071-1050,13,22,,"Serdar, MZ and Al-Ghamdi, SG",https://www.scopus.com/inward/record.uri?eid=2-s2.0-85119210868&doi=10.3390%2fsu132212367&partnerID=40&md5=20ff19827fd16a68cad46c8d5ad0796d,,,,"Hosting Mega Sport Events (MSEs) is a formidable expedition that requires enormous investments and that has the potential to reform the nation’s future and create a lasting legacy. However, the increase in environmental concerns is pushing host cities to adopt a compact event approach. Compactness increases the concentration of the load on host cities’ infrastructures, which have to preserve an acceptable level of functionality under any possible disturbance; in other words, they should be resilient. Among these infrastructures, the road network plays the most prominent role in the fans’ experiences and the event’s success. To assess its resilience during MSE, we proposed a multilevel assessment approach that focuses on the network cohesion and critical trips performance under several disturbance scenarios, including natural hazards, intentional attacks, and accidents. The framework was applied to the Doha road network, since Doha will be a host city for the FIFA World Cup in Qatar in 2022, which exhibited a high level of resilience to intentional attacks and accidents scenarios. However, during the natural hazard scenario (flooding), the network experienced severe fragmentation, signaling weak resilience and highlighting the need to improve storm management plans. Future research could investigate the use of weighted graphs to increase the accuracy or incorporate different assessment approaches into the framework. © 2021 by the authors. Licensee MDPI, Basel, Switzerland.","<p>Export Date: 21 November 2022</p> | RAYYAN-INCLUSION: {""Xuhui""=>""Included""} | RAYYAN-LABELS: road,network,resilience,infrastructure,m:network metrics | USER-NOTES: {""Xuhui""=>[""方法：基础网络指标法\n描述：针对不同程度的威胁，自然灾害，人为袭击、意外等。通过和洪水图叠合移除点（自然灾害）+随机删除点（人为袭击和意外），不断计算网络中的betweenness。用这个数值来反映网络对于各种干扰的响应能力。然后计算最短距离的数值，通过最短距离的变化和出行时间变化，衡量网络性能。\n目的：衡量网络的resilience\n补充：空间句法在城市韧性领域里，简直是主场作战""]}",10.3390/su132212367,cohesion;Complex networks;disturbance;Doha;FIFA World Cup Qatar 2022;GIS analysis;management;Management of Mega Sport Events (MSE);Multilevel resilience assessment;natural hazard;Qatar;resilience;Road networks;signaling;World;Sports,,
rayyan-389728328,Assessment of transportation system disruption and accessibility to critical amenities during flooding: Iowa case study,2021,11,1,SCIENCE OF THE TOTAL ENVIRONMENT,0048-9697,793,,,"Alabbad, Y and Mount, J and Campbell, AM and Demir, I",https://www.scopus.com/inward/record.uri?eid=2-s2.0-85108455605&doi=10.1016%2fj.scitotenv.2021.148476&partnerID=40&md5=de4ed63a37cff838643ea95050775f17,,,,"Natural disasters, such as flooding, can cause severe social, environmental, and economic damage to a community. Transportation infrastructure plays an essential role in flood response and recovery efforts. However, flooding may disturb road functionality and generate direct and indirect adverse impacts, including the loss of access to essential services. This paper presents a comprehensive analysis of flood impacts on road network topology and accessibility to amenities for major communities in the State of Iowa using graph-theoretic methods, including single-source shortest path analyses. We assessed the disruption of transportation networks on the accessibility to critical amenities (e.g., hospitals) under 100 and 500-year flood scenarios. Our analysis methodology leads toward the development of an integrated real-time decision support system that will allow decision makers to explore ""what if"" flood scenarios to identify vulnerable areas and population in their authority. These analyses could promote possible improvements (e.g., temporary relocation of critical services) to mitigate the consequences of road system failure during flooding. Due to varying environmental conditions at specific locations and effects on road topology under flood events, the results show differential impacts in edge and node losses as well as access to critical services. Results indicate that floods can lead to edge losses of up to 18%, and not only large cities but also some small cities can experience significant vulnerability to flooding. Some new or reconstructed bridges have failed to operate during analyzed flood events. During the 100 and 500-year flood return periods, the total number of inaccessible bridges within the selected cities is 184 and 294, respectively. Our work found that the shortest path length to the closest critical amenity under baseline condition can flip to the second or higher-orders during flooding. Many critical amenities have been found at risk of flooding in the studied cities. (c) 2021 Elsevier B.V. All rights reserved.","<p>Export Date: 16 November 2022</p>
<p>Export Date: 16 November 2022</p>
<p>Export Date: 21 November 2022</p> | RAYYAN-INCLUSION: {""Xuhui""=>""Included""} | RAYYAN-LABELS: road,network,infrastructure,m:network metrics | USER-NOTES: {""Xuhui""=>[""This paper presents a comprehensive analysis of flood impacts on road network topology and accessibility to amenities for major communities in the State of Iowa using graph-theoretic methods, including single-source shortest path analyses."", ""方法：基础网络指标法\n描述：使用dem和水深，判断桥要不要关。接下来，就是巨连通集的大小判断，以及最短路径平均长度的计算。通过使用距离，旅行时间或金钱数额来当权重，寻找最短路径。唯一不一样的就是，加了点设施，看了下可能受影响的人群。\n目的：评估路网的vulnerability""]}",10.1016/j.scitotenv.2021.148476,accessibility;Accessibility;amenity;article;Artificial intelligence;Case-studies;Cities;city;Critical service;Decision making;decision support system;Decision support systems;Disasters;environmental conditions;flood control;flood damage;Flood event;Flood resilience;Flood risk management;flooding;Floodings;Floods;Graph theory;human;Iowa;Location allocation;Location-allocation;location-allocation model;Natural disasters;path analysis;Regression analysis;risk assessment;Risk assessment;risk management;Risk management;Roads and streets;Systems engineering;traffic and transport;Transportation;transportation infrastructure;transportation system;Transportation system;Transportation vulnerability;United States,,
rayyan-389728329,Characterization of Vulnerability of Road Networks to Random and Nonrandom Disruptions Using Network Percolation Approach,2021,1,1,JOURNAL OF COMPUTING IN CIVIL ENGINEERING,0887-3801,35,1,,"Abdulla, B and Birgisson, B",https://www.scopus.com/inward/record.uri?eid=2-s2.0-85095975523&doi=10.1061%2f%28ASCE%29CP.1943-5487.0000938&partnerID=40&md5=620a0cf3075542dcadf324cf0bdc3280,,,,"This paper examines the vulnerability of road networks to two types of disruptions by modeling the percolation dynamics in road networks under different disruption scenarios. The objective of this paper is threefold: (1) to examine if the theoretical network robustness measure proposed in the literature is applicable for measuring the integrity of road networks during disruptions; (2) to unveil the impacts of network size on the overall vulnerability of road networks; and (3) to compare the performance profile of road networks to random and nonrandom types of disruptions. To that end, this study first modeled the road system in a community as a planar graph. Then, the percolation dynamic in the road network during the flood is captured by assigning different removal probabilities to nodes in the road network according to Bayes' rule that take floodplain types, node-elevation, and street-grade as inputs. In the end, an overall road network robustness measure and its temporal changes were obtained and for random and nonrandom scenarios, using road networks with different sizes. The results were compared in order to characterize the vulnerability of road networks under different scenarios. The proposed method was applied to the road network in central Houston during Hurricane Harvey. The results show that: (1) the theoretical network robustness measure is applicable to assess the road network robustness; (2) compared to the random percolation model, the probability (Bayes' rule) based percolation could lead to a greater decrease in the network robustness; and (3) the percolation profiles of the road networks with different sizes are not significantly different. The findings of this study could not only inform resilience enhancing decisions by the stakeholders but also could serve as a foundation for future vulnerability related research. © 2020 American Society of Civil Engineers.","<p>Export Date: 21 November 2022</p> | RAYYAN-INCLUSION: {""Xuhui""=>""Included""} | RAYYAN-LABELS: road,vulnerability,m:network metrics | USER-NOTES: {""Xuhui""=>[""(1) to examine if the theoretical network robustness measure proposed in the literature is applicable for measuring the integrity of road networks during disruptions; (2) to unveil the impacts of network size on the overall vulnerability of road networks; and (3) to compare the performance profile of road networks to random and nonrandom types of disruptions."", ""方法：基础网络指标法\n描述：首先，证明巨连通集在衡量道路connectivity上是有效的。通过对比，发现归一化之后的巨连通集鲁棒性与尺度无关，因此可以对不同规模的路网进行评估。最后，使用巨连通集进行connectivity的测量，对路网的vulnerability进行评估。\n目的：主要看看随机端点和有目标的断点，有啥区别""]}",10.1061/(ASCE)CP.1943-5487.0000938,Different sizes;Floods;Fluvial flooding;Giant connected component;Motor transportation;Network percolation;Network robustness;Network security;Network size;Percolation;Percolation dynamics;Percolation models;Performance profile;Random disruption;Roads and streets;Solvents;Temporal change,,
